"categoryName","categoryDescription"
"Chaat","Savory street food snacks typically served with a variety of chutneys."
"Biryani","Fragrant rice dish layered with marinated meat or vegetables and spices."
"Curries","Traditional Indian gravies, rich in spices and flavor."
"Tandoori","Clay oven-cooked dishes with a smoky flavor."
"Indian Breads","Varieties of flatbreads such as naan, roti, and paratha."
"Sweets","Indian desserts like gulab jamun, jalebi, and rasgulla."
"South Indian","Delicacies like dosa, idli, and sambar from southern India."
"Thali","An assortment of Indian dishes served together in one platter."
